{
  "dealer_slug": "downtown_auto_group",
  "contact_url": "https://www.buydowntown.com/contact-us/",
  "platform_hint": null,
  "snapshot_path": "tests/fixtures/form_detection/pages/downtown_auto_group/contact.html",
  "screenshot_path": "tests/fixtures/form_detection/screenshots/downtown_auto_group.png",
  "last_verified_at": "2025-09-27T21:42:31.093609+00:00",
  "expected_fields": {
    "email": {
      "selectors": [
        "input[type='email']"
      ],
      "label_text": [],
      "input_type": null,
      "required": true
    },
    "message": {
      "selectors": [
        "textarea"
      ],
      "label_text": [],
      "input_type": null,
      "required": true
    }
  },
  "form_metadata": {
    "form_selector": "",
    "submit_selector": "",
    "notes": "Populate selectors, labels, and optional fields before validating."
  }
}