{
  "dealer_slug": "tasca_chrysler_white_plains",
  "contact_url": "https://www.tascacdjrwhiteplains.com/contact-us/",
  "platform_hint": null,
  "snapshot_path": "tests/fixtures/form_detection/pages/tasca_chrysler_white_plains/contact.html",
  "screenshot_path": "tests/fixtures/form_detection/screenshots/tasca_chrysler_white_plains.png",
  "last_verified_at": "2025-09-27T21:40:30.979237+00:00",
  "expected_fields": {
    "email": {
      "selectors": [
        "input[type='email']"
      ],
      "label_text": [],
      "input_type": null,
      "required": true
    },
    "message": {
      "selectors": [
        "textarea"
      ],
      "label_text": [],
      "input_type": null,
      "required": true
    }
  },
  "form_metadata": {
    "form_selector": "",
    "submit_selector": "",
    "notes": "Populate selectors, labels, and optional fields before validating."
  }
}